url,title,abstract,body,lang_hint,author,journal,published_at,doi,quality_type
http://example.com/cat_light_11/,Impact de l'éclairage artificiel sur le bien-être du caht,"L'exposition à l'éclairage artificiel nocturne perturbe la sécrétion de mélatonine chez le chat domestique, avec des conséquences potentielles sur la régulation du sommeil et le métabolisme énergétique.","Les yeux du chat, riches en bâtonnets, permettent une sensibilité accrue en faible lumière. Le tapetum lucidum réfléchit la lumière non absorbée. Les mesures actimétriques indiquent une augmentation de l'activité crépusculaire sous éclairage ambiant réduit. Introduction: La vision féline représente une adaptation remarquable aux environnements nocturnes. Matériel et méthodes: Nous avons suivi 25 chats domestiques (Felis catus) pendant 12 semaines avec des colliers actimétriques et des caméras infrarouges. Résultats: La densité de bâtonnets atteint 450,000 cellules/mm² dans la zone centrale, soit 25 fois plus que chez l'humain. Le tapetum lucidum augmente la sensibilité d'un facteur 6 par réflexion des photons. Discussion: Ces adaptations expliquent pourquoi les chats sont particulièrement actifs au crépuscule et à l'aube.Les yeux du chat, riches en bâtonnets, permettent une sensibilité accrue en faible lumière. Le tapetum lucidum réfléchit la lumière non absorbée. Les mesures actimétriques indiquent une augmentation de l'activité crépusculaire sous éclairage ambiant réduit. Introduction: La vision féline représente une adaptation remarquable aux environnements nocturnes. Matériel et méthodes: Nous avons suivi 25 chats domestiques (Felis catus) pendant 12 semaines avec des colliers actimétriques et des caméras infrarouges. Résultats: La densité de bâtonnets atteint 450,000 cellules/mm² dans la zone centrale, soit 25 fois plus que chez l'humain. Le tapetum lucidum augmente la sensibilité d'un facteur 6 par réflexion des photons. Discussion: Ces adaptations expliquent pourquoi les chats sont particulièrement actifs au crépuscule et à l'aube.Les yeux du chat, riches en bâtonnets, permettent une sensibilité accrue en faible lumière. Le tapetum lucidum réfléchit la lumière non absorbée. Les mesures actimétriques indiquent une augmentation de l'activité crépusculaire sous éclairage ambiant réduit. Introduction: La vision féline représente une adaptation remarquable aux environnements nocturnes. Matériel et méthodes: Nous avons suivi 25 chats domestiques (Felis catus) pendant 12 semaines avec des colliers actimétriques et des caméras infrarouges. Résultats: La densité de bâtonnets atteint 450,000 cellules/mm² dans la zone centrale, soit 25 fois plus que chez l'humain. Le tapetum lucidum augmente la sensibilité d'un facteur 6 par réflexion des photons. Discussion: Ces adaptations expliquent pourquoi les chats sont particulièrement actifs au crépuscule et à l'aube.",fr,S. Moreau,Biologie & Éclairage,2025-10-01,,normal
https://www.example.com/cat_light_10008/?utm_source=referral&utm_campaign=science&tracking=true,Modulation de l'activité féline par l'intensité lumineuse,L'influence de la lumière lunaire sur le comportement de chasse nocturne a été documentée par télémétrie GPS couplée à des capteurs d'accélération sur 30 chats semi-sauvages.,"Les yeux du cat, riches en bâtonnets, permettent une sensibilité accrue en faible light.  Le tapetum lucidum réfléchit la lumière non absorbée.  Les mesures actimétriques indiquent une augmentation de l'activité crépusculaire sous éclairage ambiant réduit.  Introduction: La vision féline représente une adaptation remarquable aux environnements nocturnes.  Matériel et méthodes: Nous avons suivi 25 cats domestiques (Felis catus) pendant 12 semaines avec des colliers actimétriques et des caméras infrarouges.  Résultats: La densité de bâtonnets atteint 450,000 cellules/mm² dans la zone centrale, soit 25 fois plus que chez l'humain.  Le tapetum lucidum augmente la sensibilité d'un facteur 6 par réflexion des photons.  Discussion: Ces adaptations expliquent pourquoi les chats sont particulièrement actifs au crépuscule et à l'aube. ",mixed,Q. Michel,Biologie & Éclairage,2024-09-18,,multilingual
https://example.com/random_41,Astronomie des exoplanètes,"L'impact du télétravail sur la productivité des employés a été étudié dans plusieurs entreprises, révélant des changements dans les patterns de communication et la satisfaction au travail.","La pédagogie Montessori, développée par Maria Montessori au début du 20ème siècle, met l'accent sur le développement de l'autonomie chez l'enfant. L'environnement préparé offre des matériaux auto-correctifs qui permettent l'apprentissage par l'expérience. Les périodes sensibles correspondent aux moments optimaux pour l'acquisition de compétences spécifiques. L'éducation mixte d'âges favorise l'entraide et l'empathie. La liberté de choix dans les activités respecte le rythme individuel de chaque enfant. Les résultats incluent une meilleure concentration et une plus grande confiance en soi.",,I. White,Études Vétérinaires,2022-01-31,,off_topic
https://example.org/cat_light_22/?utm_source=search,Tapetum Lucidum and Twilight Vision in Cats,"Cats exhibit maximum spectral sensitivity around 500 nm, with limited dichromatic color vision. We explore how this color perception influences hunting behavior.","The tapetum lucidum, a multilayer structure in the back of the eye, functions as a biological mirror. Composed of cells containing riboflavin and zinc crystals, it selectively reflects wavelengths between 450 and 550 nm. Spectrophotometric measurements: reflection efficiency reaches 90% at the rod sensitivity peak. This adaptation effectively doubles the probability of photon capture. Side effect: light scattering slightly reduces visual acuity. Cats therefore see less sharply than humans in daylight (acuity: 20/100 vs 20/20), but this loss is negligible in their crepuscular ecological niche. Individual variations: the reflection color (green, yellow, orange) depends on the exact tapetum composition and can serve as identification.",en,J. Harris,Ethology Review,2020-12-24,,normal
https://example.com/cat_light_60?utm_medium=cpc,Light Preferences and Resting Areas in Domestic Cats,Feline activity cycles follow a bimodal rhythm with crepuscular peaks. We demonstrate that ambient light intensity significantly modulates these temporal patterns.,"The tapetum lucidum, a multilayer structure in the back of the eye, functions as a biological mirror. Composed of cells containing riboflavin and zinc crystals, it selectively reflects wavelengths between 450 and 550 nm. Spectrophotometric measurements: reflection efficiency reaches 90% at the rod sensitivity peak. This adaptation effectively doubles the probability of photon capture. Side effect: light scattering slightly reduces visual acuity. Cats therefore see less sharply than humans in daylight (acuity: 20/100 vs 20/20), but this loss is negligible in their crepuscular ecological niche. Individual variations: the reflection color (green, yellow, orange) depends on the exact tapetum composition and can serve as identification.",en,P. Clark,Companion Animal Journal,2017-11-20,,normal
http://example.com/random_78,Tourisme durable en 2025,Die Vulkane Islands sind spektakulär.,"L'océanographie révèle comment les gyres océaniques influencent le climat global et la distribution des espèces marines. Les courants de surface, comme le Gulf Stream, transportent la chaleur des tropiques vers les pôles. Les tourbillons de mesoscale affectent la productivité biologique. Les zones de convergence comme l'Atlantique Nord accumulent les plastiques flottants. Les changements climatiques modifient l'intensité et les trajectoires des courants, avec des impacts sur les pêcheries et la météorologie côtière. Les modèles numériques prédisent une accélération de ces changements.",,K. Johnson,Comportement et Adaptation,2017-06-22,,off_topic
http://example.com/cat_light_2001/?utm_medium=referral&article_id=2001,Les chats etl a lihgt naturelle,L’adaptation des <b>photorécepteurs</b> félins aux environnements nocturnes représente un modèle évolutif <u>fascinant.</u> Nous caractérisons la distribution spatiale des cônes et bâtonnets dans la rétine centrale et périphérique.,"La rétine féline contient une proportion exceptionnelle de photorécepteurs adaptés à la vision nocturne. Les bâtonnets représentent 96% des photorécepteurs, <strong>contre</strong> <span class='highlight'>95%</span> chez l'humain, mais avec une densité absolue bien supérieure. Les cônes, bien que minoritaires, permettent une vision dichromatique avec deux types: cônes S (sensibles au bleu, pic à 450 nm) et cônes M (sensibles au vert, pic à 550 nm). L'absence de cônes L explique la perception limitée des rouges. Des <big>expériences</big> comportementales de discrimination colorée confirment que les chats distinguent le bleu du vert mais confondent rouge et vert. Cette configuration optimise la détection de <b>mouvements</b> en faible luminosité au détriment de la richesse chromatique.",fr,J. Lefebvre,Éthologie Comparée,2025-01-29,,near_duplicate
https://testsite.net/random_140,Océanographie et courants marins,Pédagogie	Montessori : principes éducatifs et développement <small>de</small> l'autonomie chez l'enfant.,"La physique quantique, développée au début du 20ème siècle, révolutionna <var>notre</var> <tt>compréhension</tt> de la réalité à l'échelle atomique et subatomique. Les concepts d'intrication quantique, de superposition d'états et d'incertitude <var>de</var> Heisenberg défient l'intuition classique. Les applications pratiques incluent les ordinateurs quantiques, qui promettent de résoudre des problèmes complexes en cryptographie et en optimisation, et la cryptographie quantique pour des communications inviolables. L'interprétation de Copenhague, avec son effondrement de la fonction d'onde, reste débattue parmi les physiciens.",,A. Durand,Modern Animal Behavior,2017-11-04,,off_topic
http://example.com/cat_light_87/?utm_source=referral&article_id=87,Sleep Architectrue in Cats under iDfferent Light Regimes,"Cats exhibit maximum spectral sensitivity around 500 nm, with limited dichromatic <em>color</em> vision. We explore how this color perception influences <small>hunting</small> behavior.","Cat retinas, with high rod density, increase sensitivity under dim light. The tapetum lucidum reflects unabsorbed photons. Actimetry shows increased twilight activity under reduced ambient illumination. Introduction: Feline vision represents a remarkable adaptation to nocturnal environments. Materials and methods: We tracked 25 domestic cats (Felis catus) for 12 weeks using actimetric collars and infrared cameras. Results: Rod density reaches 450,000 cells/mm² in the central area, 25 times higher than in humans. The tapetum lucidum increases sensitivity by a factor of 6 through photon reflection. Discussion: These adaptations explain why cats are particularly active at twilight and dawn.",en,S. Lee,Animal Behavior Letters,2017-12-18,10.1234/cats.3321.87,normal
http://example.com/cat_light_138?utm_source=referral,Modulation of Feline Activity by Light Intensity,The adaptation of feline photoreceptors to nocturnal environments represents a fascinating evolutionary model. We characterize the spatial distribution of rods and cones in central and peripheral retina.,"Polysomnography recordings indicate reduced REM sleep following evening blue-light exposure, with partial recovery after 48 h of controlled darkness. Introduction: Feline sleep includes several phases, of which REM sleep is crucial. Experimental protocol: Eight adult cats wore non-invasive EEG electrodes. Control group: complete darkness after 8 PM. Test group: exposure to blue light (470nm, 100 lux) from 8 PM to 11 PM. Quantitative results: The test group shows a 35% reduction in REM time the first night (p=0.003), with sleep latency increased by 25 minutes. Spectral analysis reveals theta wave suppression (4-8 Hz). Recovery: After 48h of darkness, REM sleep returns to 85% of baseline. Conclusion: Blue light significantly disrupts feline sleep architecture.",en,A. Davis,Behavioral Physiology,2018-04-10,,normal
https://www.example.com/random_125/?utm_source=referral,Cuisine moléculaire avancée,Short.,"Les bienfaits du yoga pour la santé mentale ont été documentés dans de nombreuses études cliniques randomisées∞. La pratique régulière réduit les niveaux de cortisol, hormone du stress, et augmente la production d'endorphines∞. Les <span class='highlight'>techniques</span> de respiration pranayama <b>améliorent</b> la concentration et réduisent l'anxiété∞. Les postures physiques (asanas) développent la conscience corporelle et la confiance en soi∞. La méditation mindfulness, intégrée au yoga, cultive la pleine conscience et améliore la régulation émotionnelle∞. Ces effets sont particulièrement bénéfiques pour les populations souffrant de <i>stress</i> post-traumatique, de dépression et de troubles anxieux∞.",,R. Girard,Journal Français de Neurosciences,2023-07-22,,off_topic
https://testsite.net/random_73?tracking=true,Sociologie des réseaux sociaux,Géologie des plaques tectoniques : mécanismes de subduction et formation des chaînes de montagnes.,"L'océanographie révèle comment les gyres océaniques influencent le climat global et la distribution des espèces marines. Les courants de surface, comme le Gulf Stream, transportent la chaleur des tropiques vers les pôles. Les tourbillons de mesoscale affectent la productivité biologique. Les zones de convergence comme l'Atlantique Nord accumulent les plastiques flottants. Les changements climatiques modifient l'intensité et les trajectoires des courants, avec des impacts sur les pêcheries et la météorologie côtière. Les modèles numériques prédisent une accélération de ces changements.",,P. Clark,Behavioral Physiology,2024-08-08,,off_topic
https://www.example.com/cat_light_15/?utm_medium=referral,Visual Adaptation in Domestic Cats to Low-Light Environments,"Cats exhibit maximum spectral sensitivity around 500 nm, with limited dichromatic color vision. We explore how this color perception influences hunting behavior.","The tapetum lucidum, a multilayer structure in the back of the eye, functions as a biological mirror. Composed of cells containing riboflavin and zinc crystals, it <sup>selectively</sup> reflects wavelengths between 450 and 550 nm. Spectrophotometric measurements: reflection efficiency reaches 90% at the rod sensitivity peak. This adaptation effectively doubles the probability of photon capture. Side effect: light scattering slightly reduces visual acuity. Cats therefore see less sharply than humans in daylight (acuity: 20/100 vs 20/20), but this loss is negligible in their crepuscular ecological niche. Individual variations: the reflection color (green, yellow, orange) depends on the exact tapetum composition and <small>can</small> serve as identification.",en,G. Thomas,Behavioral Physiology,2019-03-27,10.1234/cats.1757.15,normal
http://example.com/random_83/?utm_medium=referral,Musique classique et développement cérébral,Botanique et plantes carnivores : adaptations morphologiques et physiologiques des Drosera et Nepenthes.,"Les cryptomonnaies et la blockchain redessinent l'avenir de la finance traditionnelle. Bitcoin, créé par Satoshi Nakamoto en 2008, introduisit le concept de monnaie numérique décentralisée. Ethereum étendit les possibilités avec les contrats intelligents, permettant des applications décentralisées (DApps). Les stablecoins comme Tether maintiennent une valeur fixe liée aux devises traditionnelles. Les banques centrales explorent les monnaies digitales de banque centrale (CBDC). Les défis incluent la volatilité, la régulation, et l'impact environnemental du minage. La finance décentralisée (DeFi) propose des alternatives aux services bancaires traditionnels.",,Q. Michel,NeuroVision,2017-10-20,,off_topic
http://example.com/cat_light_168/?utm_medium=referral&utm_campaign=testA&tracking=true,Comportement des chats au soleil,"Cette étude explore la façon dont les chats <i>réagissent</i> aux variations de lumière dans leur environnement, <small>en</small> analysant leurs préférences comportementales et <small>leurs</small> adaptations physiologiques.","Le tapetum lucidum, structure multicouche située dans le fond de l'œil, fonctionne comme un miroir biologique. Composé de cellules contenant des cristaux de riboflavine et de zinc, il réfléchit sélectivement les longueurs d'onde entre 450 et 550 nm. Mesures spectrophotométriques: l'efficacité de réflexion atteint 90% dans le pic de sensibilité des bâtonnets. Cette adaptation double effectivement la probabilité qu'un photon soit capté. Effet secondaire: la diffusion lumineuse réduit légèrement l'acuité visuelle. Les chats voient donc moins net que les humains en plein jour <sub>(acuité:</sub> 20/100 vs 20/20), mais cette perte est négligeable dans leur niche écologique crépusculaire. Variations individuelles: la couleur du reflet (vert, jaune, orange) dépend de la composition exacte du tapetum et peut servir d'identification.",fr,T. Thomas,Écologie Comportementale,2022-10-29,10.1234/cats.4784.168,normal
https://example.com/random_99?article_id=99,Microbiote intestinal et immunité,"AI models are transforming many industries through deep learning and natural language processing capabilities, with applications in healthcare, finance, and autonomous systems.","Les techniques de méditation zen, originaires du bouddhisme chan chinois, offrent des approches pratiques pour cultiver la pleine conscience et réduire le stress dans la vie quotidienne moderne. La pratique du zazen, ou méditation assise, développe la concentration et l'observation détachée des pensées. Les études cliniques randomisées démontrent des effets bénéfiques sur l'anxiété, la dépression et les troubles du sommeil. Les neurosciences cognitives révèlent des modifications de l'activité cérébrale dans les régions du cortex préfrontal et du système limbique. Au-delà des bienfaits individuels, la méditation zen influence les pratiques thérapeutiques contemporaines et les programmes de gestion du stress en entreprise.",,L. Dupont,Behavior and Adaptation,2024-08-02,,off_topic
https://testsite.net/random_66/,Musique classique et développement cérébral,Anthropologie culturelle : diversité des pratiques sociales et adaptations locales aux environnements.,"La sociologie des réseaux sociaux examine comment les plateformes numériques transforment les interactions humaines et la formation de communautés à l'ère digitale. Les algorithmes de recommandation créent des bulles de filtre, renforçant les opinions existantes. Les mouvements sociaux comme #MeToo ou Black Lives Matter démontrent le pouvoir mobilisateur des réseaux. La surveillance algorithmique soulève des questions de privacy et de liberté d'expression. Les identités numériques se construisent à travers les profils, les likes et les partages. Les fake news se propagent rapidement, nécessitant des stratégies de vérification.",,X. King,Light & Biology,2024-05-20,,off_topic
https://www.testsite.net/cat_light_1020/,Impact of Artificial Lighting on Cat Welfare ,Light exposure affects the circadian rhythms and daily activity of house cats. This research quantifies the impact of varying light intensities on diurnal and nocturnal activity patterns.,"Cat retinas, with high rod density, increase sensitivity under dim light. The tapetum lucidum reflects unabsorbed photons. Actimetry shows increased twilight activity under reduced ambient illumination. Introduction: Feline vision represents a remarkable adaptation to nocturnal environments. Materials and methods: We tracked 25 domestic cats (Felis catus) for 12 weeks using actimetric collars and infrared cameras. Results: Rod density reaches 450,000 cells/mm² in the central area, 25 times higher than in humans. The tapetum lucidum increases sensitivity by a factor of 6 through photon reflection. Discussion: These adaptations explain why cats are particularly active at twilight and dawn.",en,B. Miller,Ophthalmology Research,2018-07-28,,exact_duplicate
http://example.com/random_77?utm_source=direct&utm_campaign=promo2025,Neurosciences et apprentissage,Géologie des plaques tectoniques : mécanismes de subduction et formation des chaînes de montagnes.,"La technologie blockchain et les cryptomonnaies transforment radicalement les systèmes financiers traditionnels. La blockchain, registre distribué et immuable, élimine les intermédiaires dans les transactions financières tout en garantissant la transparence et la sécurité. Bitcoin, première cryptomonnaie, a démontré la viabilité du concept, suivi par Ethereum qui introduisit les contrats intelligents programmables. Les implications pour les systèmes bancaires centralisés sont profondes : réduction des coûts de transaction, inclusion financière pour les populations non bancarisées, et développement de la finance décentralisée (DeFi). Les défis incluent la volatilité des prix, la consommation énergétique du minage, et les questions de régulation internationale.",,H. Jackson,Physiologie Comportementale,2024-05-17,,off_topic
https://example.com/cat_light_2027?utm_campaign=testA&ref=cats,Photoreceptors in Domestic Cats,Feline activity cycles follow a bimodal rhythm with crepuscular peaks. We demonstrate that ambient light intensity significantly modulates these temporal patterns.,"Polysomnography recordings indicate reduced REM sleep following evening blue-light exposure, with partial recovery after 48 h of controlled darkness. Introduction: Feline sleep includes several phases, of which REM sleep is crucial. Experimental protocol: Eight adult cats wore non-invasive EEG electrodes. Control group: complete darkness after 8 PM. Test group: exposure to blue light (470nm, 100 lux) from 8 PM to 11 PM. Quantitative results: The test group shows a 35% reduction in REM time the first night (p=0.003), with sleep latency increased by 25 minutes. Spectral analysis reveals theta wave suppression (4-8 Hz). Recovery: After 48h of darkness, REM sleep returns to 85% of baseline. Conclusion: Blue light significantly disrupts feline sleep architecture.",en,N. Martinez,Ophthalmology Research,2018-02-08,,near_duplicate
https://example.com/random_138,Pharmcaologie des antidépresseusr,Die Vulkane Islands sind spektakulär.,L'évolution des espèces selon Darwin reste observable dans les populations contemporaines. La sélection naturelle agit sur les variations génétiques favorisant la survie et la reproduction. Les pinsons de Darwin aux Galapagos montrent une adaptation rapide du bec en réponse aux ressources alimentaires disponibles. Les bactéries développent une résistance aux antibiotiques par mutations et transferts de gènes. La spéciation sympatrique se produit quand des populations d'une même espèce divergent en l'absence de barrières géographiques. Ces mécanismes démontrent la dynamique continue de l'évolution.,,U. Simon,Sciences du Vivant,2024-04-02,,off_topic
http://example.com/cat_light_36/?utm_medium=social&ref=cats,Réponses comportementales aux variations de luminosité chez le chat,Nous analysons le rôle de la lumière sur la perception visuelle et comportementale du chat en utilisant des mesures comportementales et électrophysiologiques combinées.,"La phototransduction féline s'adapte rapidement aux transitions clair-obscur. Nous observons une modulation du rythme circadien sous éclairage LED, notamment en présence de spectres bleus (≈470 nm). Contexte: L'éclairage artificiel moderne peut perturber les rythmes biologiques naturels des félins. Méthodologie: Dix chats ont été exposés à trois conditions lumineuses: lumière naturelle, LED blanc chaud (3000K), et LED blanc froid (6500K). Des prélèvements sanguins horaires ont quantifié la mélatonine. Observations: L'exposition aux LED froides retarde la sécrétion de mélatonine de 90 minutes en moyenne. Les enregistrements comportementaux montrent un décalage significatif des pics d'activité (p<0.001). Implications: Les propriétaires devraient privilégier un éclairage chaud le soir pour respecter le cycle naturel.",fr,M. Petit,Neurosciences Appliquées,2018-06-26,,normal
https://example.com/cat_light_149,Lunar Light Influence on Nocturnal Cat Behavior,"Cats exhibit maximum spectral sensitivity around 500 nm, with limited dichromatic color vision. We explore how this color perception influences hunting behavior.","Cat retinas, with high rod density, increase sensitivity under dim light. <sub>The</sub> tapetum lucidum reflects unabsorbed photons. Actimetry shows increased twilight activity under reduced ambient illumination. Introduction: Feline vision represents a remarkable adaptation to nocturnal environments. Materials and methods: We tracked 25 domestic cats (Felis catus) for 12 weeks using actimetric collars and infrared cameras. Results: Rod density reaches 450,000 cells/mm² in the central area, 25 times higher <mark>than</mark> in humans. The tapetum lucidum increases sensitivity <i>by</i> a factor of 6 through photon reflection. Discussion: These adaptations explain why cats are particularly active at twilight and <b>dawn.</b>",en,G. Thomas,Optics and Animal Vision,2025-07-17,,normal
