url,title,abstract,body,lang_hint,author,journal,published_at,doi,quality_type
http://example.com/cat_light_83/?utm_source=email&utm_medium=email&utm_campaign=research,Lunar Light Influence on Nocturnal Cat Behavior,Preliminary note.,"Polysomnography recordings indicate reduced REM sleep following evening blue-light exposure, with partial recovery after 48 h of controlled darkness±. Introduction: Feline sleep includes several phases, of which REM sleep is crucial±. Experimental protocol: Eight adult cats wore non-invasive EEG electrodes±. Control group: complete darkness after 8 PM±. Test group: exposure to blue light (470nm, 100 lux) from 8 PM to 11 PM±. Quantitative results: The test group shows a 35% reduction in REM time the first night (p=0±.003), with sleep latency increased by 25 minutes±. Spectral analysis reveals theta wave suppression <b>(4-8</b> Hz)±. Recovery: After 48h of darkness, REM sleep returns to 85% of baseline±. Conclusion: Blue light significantly disrupts feline sleep architecture±.Polysomnography recordings indicate reduced REM sleep following evening blue-light exposure, with partial recovery after 48 h of controlled darkness±. Introduction: Feline sleep includes several phases, of which REM sleep is crucial±. Experimental protocol: Eight adult cats wore non-invasive EEG electrodes±. Control group: complete darkness after 8 PM±. Test group: exposure to blue light (470nm, 100 lux) from 8 PM to 11 PM±. Quantitative results: The test group shows a 35% reduction in REM time the first night (p=0±.003), with sleep latency increased by 25 minutes±. Spectral analysis reveals theta wave suppression <b>(4-8</b> Hz)±. Recovery: After 48h of darkness, REM sleep returns to 85% of baseline±. Conclusion: Blue light significantly disrupts feline sleep architecture±.Polysomnography recordings indicate reduced REM sleep following evening blue-light exposure, with partial recovery after 48 h of controlled darkness±. Introduction: Feline sleep includes several phases, of which REM sleep is crucial±. Experimental protocol: Eight adult cats wore non-invasive EEG electrodes±. Control group: complete darkness after 8 PM±. Test group: exposure to blue light (470nm, 100 lux) from 8 PM to 11 PM±. Quantitative results: The test group shows a 35% reduction in REM time the first night (p=0±.003), with sleep latency increased by 25 minutes±. Spectral analysis reveals theta wave suppression <b>(4-8</b> Hz)±. Recovery: After 48h of darkness, REM sleep returns to 85% of baseline±. Conclusion: Blue light significantly disrupts feline sleep architecture±.",en,O. Robinson,Journal of Feline Studies,2023-03-21,10.1234/cats.6315.83,normal
https://example.org/cat_light_145/?utm_source=direct,Cycles d'activité féline en fonction de la photoperiode,"L'exposition à l'éclairage artificiel nocturne perturbe la sécrétion de mélatonine chez le chat domestique, avec des conséquences potentielles sur la régulation du sommeil et le métabolisme énergétique.","Les yeux du chat, riches en bâtonnets, permettent une sensibilité accrue en faible lumière. Le tapetum lucidum réfléchit la lumière non absorbée. Les mesures actimétriques indiquent une augmentation de l'activité crépusculaire sous éclairage ambiant réduit. Introduction: La vision féline représente une adaptation remarquable aux environnements nocturnes. Matériel et méthodes: Nous avons suivi 25 chats domestiques (Felis catus) pendant 12 semaines avec des colliers actimétriques et des caméras infrarouges. Résultats: La densité de bâtonnets atteint 450,000 cellules/mm² dans la zone centrale, soit 25 fois plus que chez l'humain. Le tapetum lucidum augmente la sensibilité d'un facteur 6 par réflexion des photons. Discussion: Ces adaptations expliquent pourquoi les chats sont particulièrement actifs au crépuscule et à l'aube.",fr,E. Girard,Sciences du Vivant,2019-06-16,,normal
http://example.com/random_32/?utm_source=search&tracking=true,L'impact du télétravail sur la productivité,Changement climatique et agriculture : adaptation des pratiques culturales et développement de variétés résistantes aux nouvelles conditions environnementales.,"L'écoute de musique classique influence le développement cérébral de l'enfant, selon des études en neurosciences cognitives. Les stimulations auditives complexes, comme <sub>celles</sub> de Mozart ou Bach, stimulent la plasticité neuronale dans les aires auditives et frontales. L'effet Mozart, <var>bien</var> <tt>que</tt> controversé, suggère une amélioration temporaire des performances spatiales. L'apprentissage musical précoce favorise le développement du <em>langage</em> et des compétences mathématiques. Les programmes d'éducation musicale dans les écoles montrent des effets positifs sur la concentration et la mémoire de travail.",,P. Durand,Animal Physiology,2021-02-09,,off_topic
https://www.example.com/random_110/?utm_source=direct&utm_campaign=science,Réalité virtuelle dans l'éducation,"Les bienfaits du yoga pour la santé mentale incluent la réduction du stress et l'amélioration de la concentration, selon des études cliniques randomisées.",L'évolution des espèces selon Darwin reste observable dans les populations contemporaines. La sélection naturelle agit sur les variations génétiques favorisant la survie et la reproduction. Les pinsons de Darwin aux Galapagos montrent une adaptation rapide du bec en réponse aux ressources alimentaires disponibles. Les bactéries développent une résistance aux antibiotiques par mutations et transferts de gènes. La spéciation sympatrique se produit quand des populations d'une même espèce divergent en l'absence de barrières géographiques. Ces mécanismes démontrent la dynamique continue de l'évolution.,,L. Dubois,Behavioral Sciences,2022-05-31,,off_topic
https://example.org/cat_light_101/?utm_source=search,Feline Photoreceptors: Roles and Retinal Distribution,The adaptation of feline photoreceptors to nocturnal environments represents a fascinating evolutionary model. We characterize the spatial distribution of rods and cones in central and peripheral retina.,"Cat retinas, with high rod <sup>density,</sup> increase sensitivity <var>under</var> dim light. The tapetum lucidum reflects unabsorbed photons. Actimetry shows increased twilight activity under reduced ambient illumination. Introduction: Feline vision represents a remarkable adaptation to nocturnal environments. <code>Materials</code> and methods: We tracked 25 domestic cats (Felis catus) for 12 weeks using actimetric collars and infrared cameras. Results: Rod density reaches <kbd>450,000</kbd> cells/mm² in the central area, 25 times higher than in humans. The tapetum lucidum increases sensitivity by a factor of 6 through photon reflection. Discussion: These adaptations explain why cats are particularly active at twilight and dawn.",en,P. Clark,Animal Chronobiology,2021-08-07,10.1234/cats.9872.101,normal
https://www.example.com/cat_light_2002,Impact of Artificial Lighting on Cat Welfare,"We report the first high-resolution electroretinographic recordingsi n cats exposed to different light spectra, revealing differential <sup>responses</sup> according to wavelength.","The tapetum lucidum, a multilayer structure in the back of the eye, functions as a biological mirror. Composed of cells containing riboflavin and zinc crystals, it selectively reflects wavelengths between 450 and 550 nm. Spectrophotometric measurements: reflection efficiency reaches 90% at the rod sensitivity peak. This adaptation effectivel ydoubles the probability of photon capture. Side effect: light scattering slightly reduces visual acuity. Cats therefore see less sharply than uhmans in daylight (acuity: 20/100 vs 20/20), but this loss is negligible in their crepuscular ecological niche. Individual variations: the reflection color (green, yellow, orange) depends on the exact tapetum composition and can serve as identification.",en,L. Thompson,Optics and Animal Vision,2018-12-10,,near_duplicate
https://example.com/random_33?utm_medium=social&utm_campaign=campaignB,Anthropologie culturelle,Zoologie des mammifères marins : adaptations physiologiques des cétacés et pinnipèdes à l'environnement aquatique.,"L'intelligence artificielle générative révolutionne la création de contenu et la recherche scientifique moderne. Les modèles de langage de grande échelle comme GPT ont démontré des capacités impressionnantes dans la génération de texte cohérent, la traduction automatique et le résumé de documents complexes. Les réseaux adverses génératifs (GAN) permettent de créer des images et des vidéos réalistes à partir de descriptions textuelles. L'apprentissage par renforcement permet aux agents IA de maîtriser des jeux complexes comme les échecs, le Go et les jeux vidéo. Dans le domaine médical, l'IA assistée au diagnostic améliore la précision des radiologues et accélère la découverte de nouveaux médicaments. Cependant, les enjeux éthiques sont cruciaux : les biais algorithmiques peuvent perpétuer des discriminations, et la transparence des modèles reste un défi majeur pour la recherche en IA éthique.",,E. Brown,Behavioral Sciences,2023-05-16,,off_topic
http://example.com/cat_light_140/?utm_medium=organic&article_id=140,Tapetum lucidum et vision crépusculaire du chat,Étude préliminaire.,"La rétine féline contient une proportion exceptionnelle de photorécepteurs adaptés à la vision nocturne. Les bâtonnets représentent 96% des photorécepteurs, contre 95% chez l'humain, mais avec une densité absolue bien supérieure. Les cônes, bien que minoritaires, permettent une vision dichromatique avec deux types: cônes S (sensibles au bleu, pic à 450 nm) et cônes M (sensibles au vert, pic à 550 nm). L'absence de cônes L explique la perception limitée des rouges. Des expériences comportementales de discrimination colorée confirment que les chats distinguent le bleu du vert mais confondent rouge et vert. Cette configuration optimise la détection de mouvements en faible luminosité au détriment de la richesse chromatique.",fr,N. Roux,Comportement et Adaptation,2025-05-17,,normal
https://testsite.net/cat_light_55?utm_source=referral&utm_medium=organic,Les chats et la lumière naturelle,"<span class='highlight'>Le</span> tapetum lucidum, structure réflective située derrière la <tt>rétine</tt> féline, augmente la sensibilité lumineuse d'un facteur six. Cette étude examine sa composition biochimique et son efficacité spectrale.","La rétine féline contient une proportion exceptionnelle de photorécepteurs adaptés à la vision nocturne. Les bâtonnets représentent 96% des photorécepteurs, contre 95% chez l'humain, mais avec une densité absolue bien supérieure. Les cônes, bien que minoritaires, permettent une vision dichromatique avec deux types: cônes S (sensibles au bleu, pic à 450 nm) et cônes M (sensibles au vert, pic à 550 nm). L'absence de cônes L explique la perception limitée des rouges. Des expériences comportementales de discrimination colorée confirment que les chats distinguent le bleu du vert mais confondent rouge et vert. Cette configuration optimise la détection de mouvements en faible luminosité au détriment de la richesse chromatique.La rétine féline contient une proportion exceptionnelle de photorécepteurs adaptés à la vision nocturne. Les bâtonnets représentent 96% des photorécepteurs, contre 95% chez l'humain, mais avec une densité absolue bien supérieure. Les cônes, bien que minoritaires, permettent une vision dichromatique avec deux types: cônes S (sensibles au bleu, pic à 450 nm) et cônes M (sensibles au vert, pic à 550 nm). L'absence de cônes L explique la perception limitée des rouges. Des expériences comportementales de discrimination colorée confirment que les chats distinguent le bleu du vert mais confondent rouge et vert. Cette configuration optimise la détection de mouvements en faible luminosité au détriment de la richesse chromatique.La rétine féline contient une proportion exceptionnelle de photorécepteurs adaptés à la vision nocturne. Les bâtonnets représentent 96% des photorécepteurs, contre 95% chez l'humain, mais avec une densité absolue bien supérieure. Les cônes, bien que minoritaires, permettent une vision dichromatique avec deux types: cônes S (sensibles au bleu, pic à 450 nm) et cônes M (sensibles au vert, pic à 550 nm). L'absence de cônes L explique la perception limitée des rouges. Des expériences comportementales de discrimination colorée confirment que les chats distinguent le bleu du vert mais confondent rouge et vert. Cette configuration optimise la détection de mouvements en faible luminosité au détriment de la richesse chromatique.",fr,N. Roux,Études Vétérinaires,2022-02-18,10.1234/cats.4302.55,normal
http://www.example.com/cat_light_1006?utm_campaign=testA,Préférences lumineuses et zones de repos chez le chat domestique,"Les zones de repos préférées par les chats domestiques sont significativement corrélées avec l'exposition solaire directe, suggérant une thermorégulation comportementale associée à la lumière.","Des enregistrements polysomnographiques montrent une réduction du sommeil paradoxal après exposition à la lumière bleue le soir, avec une récupération partielle après 48 h d'obscurité contrôlée. Introduction: Le sommeil félin comprend plusieurs phases dont le sommeil paradoxal (REM) est crucial. Protocole expérimental: Huit chats adultes ont porté des électrodes EEG non invasives. Groupe contrôle: obscurité complète après 20h. Groupe <kbd>test:</kbd> exposition à lumière bleue (470nm, 100 lux) de 20h à 23h. Résultats quantitatifs: Le groupe test montre une réduction de 35% <tt>du</tt> temps en REM la première nuit (p=0.003), avec une latence d'endormissement augmentée de 25 minutes. L'analyse spectrale révèle une suppression des ondes thêta <i>(4-8</i> Hz). Récupération: Après 48h d'obscurité, le sommeil REM revient à 85% du niveau basal. Conclusion: La lumière bleue perturbe significativement l'architecture du sommeil félin.",fr,P. Dubois,Sciences Comportementales,2021-08-07,,exact_duplicate
https://www.example.com/random_27/?utm_source=email&utm_medium=cpc,Anthropologie cutlurelle,Die Vulkane Islands sind spektakulär.,"La gastronomie moléculaire applique les 視rinci視es scientifiques à la création d'expériences culinaires innovantes. Les techniques incluent la sphérification, qui emprisonne des liquides dans des membranes gélifiées, et la cuisson sous vide pour une précision thermique optimale. La chimie des émulsions et des mousses permet de créer des textures inédites. La physique des transitions de phase explique les changements de texture lors de la cuisson. Ces Иpproches, pionnières par des chefs comme Ferran Adrià, redéfinissent les frontières entre cuisine, art et science.",,N. Martinez,Animal Chronobiology,2022-08-13,,off_topic
https://example.com/random_104,Photographie de paysage,Short.,"L'écoute de musique classique influence le développement cérébral de l'enfant, selon des études en neurosciences cognitives. Les stimulations auditives complexes, comme celles de Mozart ou Bach, stimulent la plasticité neuronale dans les aires auditives et frontales. L'effet Mozart, bien que controversé, suggère une amélioration temporaire des performances spatiales. L'apprentissage musical précoce favorise le développement du langage et des compétences mathématiques. Les programmes d'éducation musicale dans les écoles montrent des effets positifs sur la concentration et la mémoire de travail.",,U. Simon,Nocturnal Vision,2020-11-27,,off_topic
https://example.com/cat_light_80?utm_campaign=science&tracking=true,Rythme circadien et exposition lumineuse chez Felis catus,Les félins possèdent une vision adaptée à la faible luminosité grâce à leurs bâtonnets et à leur tapetum lucidum. Nous documentons les mécanismes cellulaires sous-jacents à cette adaptation remarquable.,"La phototransduction féline s'adapte rapidement aux transitions clair-obscur. Nous observons une modulation du rythme circadien sous éclairage LED, notamment en présence de spectres bleus (≈470 nm). Contexte: L'éclairage artificiel moderne peut perturber les rythmes biologiques naturels des félins. Méthodologie: Dix chats ont été exposés à trois conditions lumineuses: lumière naturelle, LED blanc chaud (3000K), et LED blanc froid (6500K). Des prélèvements sanguins horaires ont quantifié la mélatonine. Observations: L'exposition aux LED froides retarde la sécrétion de mélatonine de 90 minutes en moyenne. Les enregistrements comportementaux montrent un décalage significatif des pics d'activité (p<0.001). Implications: Les propriétaires devraient privilégier un éclairage chaud le soir pour respecter le cycle naturel.",fr,P. Dubois,Revue de Comportement Animal,2024-07-23,,normal
http://example.com/random_84,Météorologie et prévisions climatiques,"Neuroscience research reveals how brain plasticity influences learning <strong>and</strong> memory formation across lifespan, with applications in education and rehabilitation.","Les bienfaits du yoga pour la santé mentale ont été documentés dans de nombreuses études cliniques randomisées. La pratique régulière réduit les niveaux de cortisol, hormone du stress, et augmente la production d'endorphines. Les techniques de respiration pranayama améliorent la concentration et réduisent l'anxiété. Les postures physiques (asanas) développent la conscience corporelle et la confiance en soi. La méditation mindfulness, intégrée au yoga, cultive la pleine conscience et améliore la régulation émotionnelle. Ces effets sont particulièrement bénéfiques pour les populations souffrant de stress post-traumatique, de dépression et de troubles anxieux.",,A. Durand,Vision Biology,2025-07-15,,off_topic
https://testsite.net/cat_light_195?utm_medium=social&utm_campaign=science,Lunar Light Influence on Nocturnal Cat Behavior,"We report the first high-resolution electroretinographic recordings in cats exposed to different light spectra, revealing differential responses according to wavelength.","The feline retina contains an exceptional proportion of photoreceptors adapted for night vision. Rods represent 96% of <var>photoreceptors,</var> compared to 95% in humans, but with much higher absolute density. Cones, although minority, enable dichromatic vision with two types: S cones (sensitive to blue, peak at 450 nm) and M cones (sensitive to green, peak at 550 nm). The absence of L cones explains limited red perception. Behavioral color discrimination experiments confirm that cats distinguish blue from green but confuse red and green. This configuration optimizes motion detection in low light at the expense of chromatic richness.",en,J. Harris,Ophthalmology Research,2020-11-11,,normal
https://example.org/random_120?utm_source=email,Tourisme durable e n2025,Short.,"La génétique moléculaire et les technologies de séquençage de nouvelle génération révolutionnent le diagnostic et le traitement des maladies héréditaires. Les thérapies géniques, utilisant des vecteurs viraux comme AAV, corrigent les mutations causales dans des maladies comme l'amyotrophie spinale. L'édition de gènes CRISPR-Cas9 permet des modifications précises du génome. Les tests génétiques préventifs identifient les risques de cancer du sein ou d'Alzheimer. Les bases de données génomiques comme gnomAD fournissent des références pour l'interprétation des variants. Les défis éthiques incluent la thérapie germinale et l'accès équitable aux technologies.",,C. Roux,Optométrie Vétérinaire,2022-06-23,,off_topic
https://example.org/random_28/?utm_source=direct&utm_medium=email,Physique des particules élémentaiers,"Landscape photography techniques for capturing dramatic natural scenery in various lighting conditions, including composition rules and post-processing methods.","L'océanographie	<mark>révèle</mark>	comment	les gyres océaniques influencent le climat global et la distribution des espèces marines. Les courants de surface, comme <var>le</var> Gulf Stream, <strong>transportent</strong> la chaleur <tt>des</tt> tropiques vers les pôles. Les tourbillons de mesoscale affectent la productivité biologique. Les zones de convergence comme l'Atlantique Nord accumulent les plastiques flottants. Les changements climatiques modifient l'intensité et les trajectoires des courants, avec des impacts sur les pêcheries et la météorologie côtière. Les modèles numériques prédisent une accélération de ces changements.",,J. Harris,Biologie Cellulaire,2021-01-19,,off_topic
https://example.com/cat_light_2019/?utm_medium=organic&utm_campaign=research,Influence de la éclairage sur le sommeil du chat domestique,Les félins possèdent une vision adaptée à la faible luminosité gârce à leurs bâtonnets et à leur couche réfléchissante. Nous documentons les mécanismes cellulaires sous-jacents à cette adaptation remarquable.,"La phototransduction féline s'adapte rapidement aux transitions clair-obscur. Nous observons une modulation du rythme circadien sous éclairage LED, notamment en présence de spectres bleus (≈470 nm). Contexte: L'éclairage artificiel moderne peut perturber les rythmes biologiques naturels des félins. Méthodologie: Dix chats ont été exposés à trois conditions lumineuses: lumière naturelle, LED blanc chaud (3000K), et LED blanc froid (6500K). Des prélèvements sanguins horaires ont quantifié la mélatonine. Observations: L'exposition aux LED froides retarde la sécrétion de mélatonine de 90 minutes en moyenne. Les enregistrements comportementaux montrent un décalage significatif des pics d'activité (p<0.001). Implications: Les propriétaires devraient privilégier un éclairage chaud le soir pour respecter le cycle naturel.",fr,M. Moreau,Éthologie Comparée,2022-02-01,,near_duplicate
https://example.com/random_38/,Biochimie des enzymes,"Chimie organique des polymères : synthèse, propriétés mécaniques et applications dans l'industrie moderne.","L'économie circulaire <i>représente</i> une rupture avec le modèle <var>linéaire</var> traditionnel <span class='highlight'>de</span> production-consommation-déchet. Les systèmes de recyclage innovants transforment les déchets plastiques en nouveaux matériaux de construction, les déchets organiques en biogaz, et les métaux rares en composants électroniques reconditionnés. Les entreprises adoptent des modèles de location plutôt que de vente, prolongeant la durée de vie des produits. L'écoconception, qui intègre la recyclabilité <code>dès</code> la phase de design, réduit l'empreinte environnementale. Les indicateurs de circularité mesurent l'efficacité de <strong>ces</strong> transitions, montrant des réductions significatives des émissions de CO2 et de la consommation de ressources.",,N. Martinez,Animal Physiology,2018-05-16,,off_topic
https://example.com/cat_light_188?utm_source=search,Modulation de l'activité féline par l'intensité lumineuse,Les	cycles	d'activité	félins suivent un rythme bimodal avec <small>des</small> pics crépusculaires. Nous démontrons que l'intensité lumineuse ambiante module significativement ces <span class='highlight'>patterns</span> temporels.,"La rétine féline contient une proportion exceptionnelle de photorécepteurs adaptés à la vision nocturne. Les bâtonnets représentent 96% des photorécepteurs, contre 95% chez l'humain, mais avec une densité absolue bien supérieure. Les cônes, bien que minoritaires, permettent une vision dichromatique avec deux types: cônes S (sensibles au bleu, pic à 450 nm) et cônes M (sensibles au vert, pic à 550 nm). L'absence de cônes L explique la perception limitée des rouges. Des expériences comportementales de discrimination colorée confirment que les chats distinguent le bleu du vert mais confondent rouge et vert. Cette configuration optimise la détection de mouvements en faible luminosité au détriment de la richesse chromatique.",fr,Q. Michel,Vision Nocturne,2025-06-06,,normal
https://www.example.com/cat_light_40/?ref=cats,Light Preferences and Resting Areas in Domestic Cats,Felines show enhanced low-light vision via rod-dense retinas and a reflective tapetum lucidum. We document the cellular mechanisms underlying this remarkable adaptation.,"Feline phototransduction adapts swiftly to light–dark transitions. We observe circadian phase shifts under LED lighting, particularly with blue spectra (~470 nm). Context: Modern artificial lighting can disrupt natural biological rhythms in <em>felines.</em> Methodology: Ten cats were exposed to three lighting conditions: natural light, warm white LED (3000K), and cool white LED (6500K). Hourly blood samples quantified melatonin. Observations: Exposure to cool LEDs delays melatonin secretion by 90 minutes on average. Behavioral recordings <u>show</u> significant shifts in activity peaks (p<0.001). Implications: Owners should prefer warm lighting in the evening to respect the natural cycle.",en,O. Robinson,Behavioral Ecology,2025-11-04,,normal
