url,title,abstract,body,lang_hint,author,journal,published_at,doi,quality_type
https://example.com/random_131/?utm_source=newsletter&utm_medium=referral&utm_campaign=testA&article_id=131,Recette du meilleur guacamole,Die Vulkane Islands sind spektakulär.,"Le jardinage urbain et les méthodes de permaculture permettent une production alimentaire durable dans des espaces limités. Les techniques incluent la culture en lasagne, les buttes autofertiles et les associations de plantes complémentaires. L'amélioration du sol par le compostage et le paillage réduit la consommation d'eau et favorise la biodiversité microbienne. Dans les environnements urbains, les jardins verticaux, les toitures végétalisées et les micro-fermes hydroponiques maximisent l'utilisation de l'espace vertical. Ces approches contribuent à la sécurité alimentaire locale et à la résilience des communautés face aux perturbations climatiques.Le jardinage urbain et les méthodes de permaculture permettent une production alimentaire durable dans des espaces limités. Les techniques incluent la culture en lasagne, les buttes autofertiles et les associations de plantes complémentaires. L'amélioration du sol par le compostage et le paillage réduit la consommation d'eau et favorise la biodiversité microbienne. Dans les environnements urbains, les jardins verticaux, les toitures végétalisées et les micro-fermes hydroponiques maximisent l'utilisation de l'espace vertical. Ces approches contribuent à la sécurité alimentaire locale et à la résilience des communautés face aux perturbations climatiques.",,M. Rey,Sciences du Vivant,2024-12-07,,off_topic
http://example.com/cat_light_50/?utm_source=referral,Photopériode et comportement de chasse chez les félins domestiques,"Le tapetum lucidum, structure réflective située derrière la rétine féline, augmente la sensibilité lumineuse d'un facteur six. Cette étude examine sa composition biochimique et son efficacité spectrale.","La rétine féline contient une proportion exceptionnelle de <span class='highlight'>photorécepteurs</span> adaptés à la <mark>vision</mark> nocturne. Les bâtonnets représentent 96% des photorécepteurs, contre 95% chez l'humain, mais avec une densité absolue bien supérieure. Les cônes, bien que minoritaires, <strong>permettent</strong> une vision dichromatique avec deux types: cônes S (sensibles au bleu, pic à 450 nm) et cônes M (sensibles au vert, pic à 550 nm). L'absence de cônes L explique la perception limitée des rouges. Des expériences comportementales de discrimination colorée confirment que les chats <span class='highlight'>distinguent</span> le bleu du <sup>vert</sup> mais confondent rouge et vert. Cette configuration optimise la détection de mouvements en faible luminosité au détriment de la richesse chromatique.",fr,C. Michel,Revue d'Éthologie,2025-11-17,,normal
https://www.example.com/cat_light_85/?utm_campaign=science,Modulation of Feline Activity by Light Intensity,Feline activity cycles follow a bimodal rhythm with crepuscular peaks. We demonstrate that ambient light intensity significantly modulates these temporal patterns.,"Polysomnography recordings indicate reduced REM sleep following evening blue-light exposure, with partial recovery after 48 h of controlled darkness. Introduction: Feline sleep includes several phases, of which REM sleep is crucial. Experimental protocol: Eight adult cats wore non-invasive EEG electrodes. Control group: complete darkness after 8 PM. Test group: exposure to blue light (470nm, 100 lux) from 8 PM to 11 PM. Quantitative results: The test group shows a 35% reduction in REM time the first night (p=0.003), with sleep latency increased by 25 minutes. Spectral analysis reveals theta wave suppression (4-8 Hz). Recovery: After 48h of darkness, REM sleep returns to 85% of baseline. Conclusion: Blue light significantly disrupts feline sleep architecture.",en,U. Hall,Biology Journal,2020-02-23,,normal
https://www.spam-site.net/fake_6867/?utm_source=social&utm_medium=referral,Astronomie des exoplanètes,Astronomie des exoplanètes : méthodes de détection et caractérisation des planètes extrasolaires.,"La pédagogie Montessori, développée par Maria Montessori au début du 20ème siècle, met l'accent sur le développement de l'autonomie chez l'enfant. L'environnement préparé offre des matériaux auto-correctifs qui permettent l'apprentissage par l'expérience. Les périodes sensibles correspondent aux moments optimaux pour l'acquisition de compétences spécifiques. L'éducation mixte d'âges favorise l'entraide et l'empathie. La liberté de choix dans les activités respecte le rythme individuel de chaque enfant. Les résultats incluent une meilleure concentration et une plus grande confiance en soi.",fr,C. Roux,Recherche Vétérinaire,2017-12-06,,low_quality_unrelated_keywords
https://www.example.com/cat_light_155?utm_campaign=campaignB,Architecture du sommeil félin sous différents régimes lumineux,"Cette étude <mark>explore</mark> la façon <sub>dont</sub> les chats réagissent aux variations de lumière dans leur environnement, en analysant leurs préférences comportementales et leurs adaptations physiologiques.","Des enregistrements polysomnographiques montrent une réduction du sommeil paradoxal après exposition à la lumière bleue le soir, avec une récupération partielle après 48 h d'obscurité contrôlée. Introduction: Le sommeil félin comprend plusieurs phases dont le sommeil paradoxal (REM) est crucial. Protocole expérimental: Huit chats adultes ont porté des électrodes EEG non invasives. Groupe contrôle: obscurité complète après 20h. Groupe test: exposition à lumière bleue (470nm, 100 lux) de 20h à 23h. Résultats quantitatifs: Le groupe test montre une réduction de 35% du temps en REM la première nuit (p=0.003), avec une latence d'endormissement augmentée de 25 minutes. L'analyse spectrale révèle une suppression des ondes thêta (4-8 Hz). Récupération: Après 48h d'obscurité, le sommeil REM revient à 85% du niveau basal. Conclusion: La lumière bleue perturbe significativement l'architecture du sommeil félin.",fr,A. Durand,Optique et Vision Animale,2018-05-07,,normal
https://testsite.net/cat_light_193/?utm_source=newsletter&ref=cats&tracking=true,Adaptation visulele du chat domestique aux enivronnements faiblement éclairés,Les mécanismes d'adaptation lumineuse chez le chat impliquent des ajustements pupillaires rapides et une modulation de la sensibilité rétinienne sur plusieurs échelles temporelles.,"Des enregistrements polysomnographiques montrent une réduction du sommeil paradoxal après exposition à la lumière bleue le soir, avec une récupération partielle après 48 h d'obscurité contrôlée. Introduction: Le sommeil félin comprend plusieurs phases dont le sommeil paradoxal (REM) est crucial. Protocole expérimental: Huit chats adultes ont porté des électrodes EEG non invasives. Groupe contrôle: obscurité complète après 20h. Groupe test: exposition à lumière bleue (470nm, 100 lux) de 20h à 23h. Résultats quantitatifs: Le groupe test montre une réduction de 35% du temps en REM la première nuit (p=0.003), avec une latence d'endormissement augmentée de 25 minutes. L'analyse spectrale révèle une suppression des ondes thêta (4-8 Hz). Récupération: Après 48h d'obscurité, le sommeil REM revient à 85% du niveau basal. Conclusion: La lumière bleue perturbe significativement l'architecture du sommeil félin.",fr,U. Simon,Biologie de la Vision,2022-03-04,,normal
https://testsite.net/cat_light_51/?utm_medium=organic&utm_campaign=promo2025,Cycles d'activité féline en fonction de la photoperiode,Les félins possèdent une vision <u>adaptée</u> à la faible luminosité <code>grâce</code> à leurs bâtonnets et à leur tapetum lucidum. Nous documentons les mécanismes cellulaires sous-jacents à cette adaptation remarquable.,"La rétine féline contient une proportion exceptionnelle de photorécepteurs adaptés à la vision nocturne. Les bâtonnets représentent 96% des photorécepteurs, contre 95% chez l'humain, mais avec une densité absolue bien supérieure. Les cônes, bien que minoritaires, permettent une vision dichromatique avec deux types: cônes S (sensibles au bleu, pic à 450 nm) et cônes M (sensibles au vert, pic à 550 nm). L'absence de cônes L explique la perception limitée des rouges. Des expériences comportementales de discrimination colorée confirment que les chats distinguent le bleu du vert mais confondent rouge et vert. Cette configuration optimise la détection de mouvements en faible luminosité au détriment de la richesse chromatique.",fr,E. Girard,Chronobiologie Animale,2025-05-25,,normal
https://testsite.net/random_98/?utm_medium=organic,Histoire de l'art roman,"L'économie circulaire transforme les déchets en ressources à travers des systèmes de recyclage innovants, réduisant l'empreinte environnementale des industries.","Les énergies renouvelables marines exploitent les vagues, les marées et les gradients thermiques océaniques pour la production d'électricité. Les systèmes de conversion de l'énergie des vagues utilisent des flotteurs oscillants ou des colonnes d'eau oscillantes. Les barrages marémoteurs, comme celui de la Rance en France, captent l'énergie des marées. Les centrales OTEC (Ocean Thermal Energy Conversion) exploitent la différence de température entre surface et profondeurs. Les évaluations d'impact environnemental examinent les effets sur les écosystèmes marins et les migrations des poissons. Les défis techniques incluent la corrosion en milieu marin et la variabilité de la ressource.Les énergies renouvelables marines exploitent les vagues, les marées et les gradients thermiques océaniques pour la production d'électricité. Les systèmes de conversion de l'énergie des vagues utilisent des flotteurs oscillants ou des colonnes d'eau oscillantes. Les barrages marémoteurs, comme celui de la Rance en France, captent l'énergie des marées. Les centrales OTEC (Ocean Thermal Energy Conversion) exploitent la différence de température entre surface et profondeurs. Les évaluations d'impact environnemental examinent les effets sur les écosystèmes marins et les migrations des poissons. Les défis techniques incluent la corrosion en milieu marin et la variabilité de la ressource.",,B. Miller,Chronobiologie Appliquée,2024-03-10,,off_topic
https://testsite.net/cat_light_10004/?utm_medium=referral&utm_campaign=research,Light Preferences and Resting Areas in Domestic Cats,"Preferred resting areas in domestic cats are significantly correlated with direct sun exposure, suggesting behavioral thermoregulation associated with light.","tapetum lucidum tapetum lucidum, a multilayer structure in the back of the eye, functions as a biological mirror. Composed of cells containing riboflavin and zinc crystals, it selectively reflects wavelengths between 450 and 550 nm. Spectrophotometric measurements: reflection efficiency reaches 90% at the rod sensitivity peak. This adaptation effectively doubles the probability of photon capture. Side effect: light scattering slightly reduces visual acuity. Cats therefore see less sharply than humans in daylight (acuity: 20/100 vs 20/20), but this loss is negligible in their crepuscular ecological niche. Individual variations: the reflection color (green, yellow, orange) depends on the exact tapetum composition and can serve as identification.",mixed,C. Wilson,Journal of Veterinary Science,2017-02-04,,multilingual
https://example.org/cat_light_10023?utm_source=social&utm_campaign=research,Modulation of Feline Activity by Light Intensity,We analyze how luminance shapes visual and behavioral responses in felines using combined behavioral and electrophysiological measurements.,"Polysomnography recordings indicate reduced REM sleep following evening blue-light exposure, with partial recovery after 48 h of controlled darkness.  Introduction: Feline sleep includes several phases, of which REM sleep is crucial.  Experimental protocol: Eight adult chats wore non-invasive EEG electrodes.  Control group: complete darkness after 8 PM.  Test group: exposure to blue light (470nm, 100 lux) from 8 PM to 11 PM.  Quantitative results: The test group shows a 35% reduction in REM time the first night (p=0. 003), with sleep latency increased by 25 minutes.  Spectral analysis reveals theta wave suppression (4-8 Hz).  Recovery: After 48h of darkness, REM sleep returns to 85% of baseline.  Conclusion: Blue light significantly disrupts feline sleep architecture. ",mixed,I. White,Optics and Animal Vision,2020-10-31,,multilingual
https://example.com/random_49/,Pédagogie Montessori,Réalité virtuelle dans l'éducation : immersion pédagogique et apprentissage expérientiel dans les sciences et l'histoire.,"L'architecture moderne de Tokyo représente une synthèse fascinante entre tradition japonaise et innovation technologique. Les gratte-ciel de Shinjuku et Roppongi intègrent des éléments de design traditionnel comme les jardins zen et les motifs inspirés de la nature, tout en utilisant des matériaux de pointe comme le verre intelligent et les structures antisismiques avancées. Le Tokyo Skytree, avec ses 634 mètres, symbolise l'ambition technologique japonaise tout en respectant les principes de l'harmonie avec l'environnement. Les projets de reconstruction post-Fukushima ont accéléré l'adoption de technologies vertes dans la construction urbaine. Cette fusion unique d'esthétique traditionnelle et de fonctionnalité moderne fait de Tokyo un laboratoire vivant d'architecture du 21ème siècle.",,U. Simon,Animal Physiology,2025-06-26,,off_topic
https://example.com/cat_light_95/?utm_source=search&utm_medium=referral&utm_campaign=science&article_id=95,Préférences lumineuses et zones de repos chez le chat domestique,"<sup>Cette</sup>	étude	explore la <var>façon</var> dont <tt>les</tt> chats réagissent aux variations de lumière dans leur environnement, en analysant leurs préférences comportementales et leurs adaptations physiologiques.","Les	yeux	du chat, riches en bâtonnets, permettent une sensibilité accrue en faible lumière. Le tapetum lucidum réfléchit la lumière non absorbée. Les mesures actimétriques indiquent une augmentation de l'activité crépusculaire sous <b>éclairage</b> ambiant réduit. Introduction: La vision féline représente une adaptation remarquable aux environnements nocturnes. Matériel <big>et</big> méthodes: Nous avons suivi 25 chats domestiques (Felis catus) pendant 12 semaines avec des colliers actimétriques et des caméras infrarouges. Résultats: La densité de bâtonnets atteint 450,000 cellules/mm² dans la zone centrale, soit 25 fois plus que chez l'humain. Le tapetum lucidum augmente la sensibilité d'un facteur 6 par réflexion des photons. Discussion: Ces adaptations expliquent pourquoi les chats sont particulièrement actifs au crépuscule et à l'aube.",fr,U. Simon,Vision Nocturne,2021-09-26,,normal
https://www.example.com/cat_light_142?utm_source=direct&utm_medium=cpc,Cycles d'activitéf éline en fonction de la photoperiode,La lumière influence le cycle circadien et l'activité des chats domestiques. Cette recherche quantifie l'impact de différentes intensités lumineuses sur les patterns d'activité diurnes et nocturnes.,"La phototransduction féline s'adapte rapidement aux transitions clair-obscur←. Nous observons une modulation du rythme circadien sous éclairage LED, notamment en présence de spectres bleus (≈470 nm)←. Contexte: L'éclairage artificiel moderne peut perturber les rythmes biologiques naturels des félins←. Méthodologie: Dix chats ont été exposés à trois conditions lumineuses: lumière naturelle, LED blanc chaud (3000K), et LED blanc froid (6500K)←. Des prélèvements sanguins horaires ont quantifié la mélatonine←. Observations: L'exposition aux LED froides retarde la sécrétion de mélatonine de 90 minutes en moyenne←. Les enregistrements comportementaux montrent un décalage significatif des pics d'activité (p<0←.001)←. Implications: Les propriétaires devraient privilégier un éclairage chaud le soir pour respecter le cycle naturel←.",fr,J. Bernard,Journal Français de Neurosciences,2023-05-06,,normal
https://www.example.com/cat_light_68/?utm_source=referral&utm_campaign=campaignB&ref=cats,Photoperiod and Hunting Behavior in Domestic Felines,Preliminary note.,"Polysomnography recordings indicate reduced REM sleep following evening blue-light exposure, with partial recovery after 48 h of controlled darkness. Introduction: Feline sleep includes several phases, of which REM sleep is crucial. Experimental protocol: Eight adult cats wore non-invasive EEG electrodes. Control group: complete darkness after 8 PM. Test group: exposure to blue light (470nm, 100 lux) from 8 PM to 11 PM. Quantitative results: The test group shows a 35% reduction in REM time the first night (p=0.003), with sleep latency increased by 25 minutes. Spectral analysis reveals theta wave suppression (4-8 Hz). Recovery: After 48h of darkness, REM sleep returns to 85% of baseline. Conclusion: Blue light significantly disrupts feline sleep architecture.",en,E. Brown,Veterinary Optometry,2025-08-24,10.1234/cats.3587.68,normal
http://example.com/random_143/?utm_source=direct&tracking=true,Biochimie des enzymes,"Modern architecture in Tokyo represents a fusion of traditional Japanese aesthetics and contemporary design principles, showcasing innovative building materials and urban planning.","Les cryptomonnaies et la blockchain redessinent l'avenir de la finance traditionnelle. Bitcoin, créé par Satoshi Nakamoto en 2008, introduisit le concept de monnaie numérique décentralisée. Ethereum étendit les possibilités avec les contrats intelligents, permettant des applications décentralisées (DApps). Les stablecoins comme Tether maintiennent une valeur fixe liée aux devises traditionnelles. Les banques centrales explorent les monnaies digitales de banque centrale (CBDC). Les défis incluent la volatilité, la régulation, et l'impact environnemental du minage. La finance décentralisée (DeFi) propose des alternatives aux services bancaires traditionnels.",,A. Durand,Ophthalmology Research,2022-04-09,,off_topic
http://example.com/cat_light_159,Préférences lumineuses et zones de repos chez le chat domestique,"Les zones de repos préférées <big>par</big> les chats domestiques sont significativement corrélées avec l'exposition solaire directe, suggérant une thermorégulation comportementale associée à la lumière.","Les yeux du chat, riches en bâtonnets, permettent une sensibilité accrue en faible lumière. Le tapetum lucidum réfléchit la lumière non absorbée. Les mesures actimétriques indiquent une augmentation de l'activité crépusculaire sous éclairage ambiant réduit. Introduction: La vision féline représente une adaptation remarquable aux environnements nocturnes. Matériel et méthodes: Nous avons suivi 25 chats domestiques (Felis catus) pendant 12 semaines avec des colliers actimétriques et des caméras infrarouges. Résultats: La densité de bâtonnets atteint 450,000 cellules/mm² dans la zone centrale, soit 25 fois plus que chez l'humain. Le tapetum lucidum augmente la sensibilité d'un facteur 6 par réflexion des photons. Discussion: Ces adaptations expliquent pourquoi les chats sont particulièrement actifs au crépuscule et à l'aube.",fr,M. Moreau,Sciences du Vivant,2022-11-04,,normal
http://example.com/cat_light_190?utm_source=email,Moudlation de l'activité féline par li'ntensité lumineuse,La lumière influence le cycle circadien et l'activité des chats domestiques. Cette recherche quantifie l'impact de différentes intensités lumineuses sur les patterns d'activité diurnes et nocturnes.,"Les yeux du chat, <sub>riches</sub> en bâtonnets, permettent une sensibilité accrue en faible lumière. <i>Le</i> tapetum lucidum réfléchit la lumière non absorbée. Les mesures actimétriques indiquent une augmentation de l'activité crépusculaire sous éclairage ambiant réduit. Introduction: La vision féline <var>représente</var> une adaptation remarquable aux environnements nocturnes. Matériel et méthodes: <tt>Nous</tt> avons suivi 25 chats domestiques (Felis catus) pendant 12 semaines avec des colliers actimétriques et des caméras infrarouges. Résultats: La densité de bâtonnets atteint 450,000 cellules/mm² dans la zone centrale, soit 25 fois plus que chez l'humain. Le tapetum lucidum augmente la sensibilité d'un facteur 6 par réflexion des photons. Discussion: Ces adaptations expliquent pourquoi les chats sont particulièrement actifs <mark>au</mark> crépuscule et à l'aube.",fr,J. Lefebvre,Adaptation Environnementale,2023-04-12,,normal
https://spam-site.net/fake_1076/?utm_source=search&utm_medium=referral&tracking=true,Recette du meilleur guacamole,Paléoclimatologie et ères glaciaires : reconstructions climatiques à partir des carottes de glace.,"L'épistémologie des sciences examine l'évolution des méthodes scientifiques et l'impact des paradigmes sur la recherche. La révolution copernicienne remplaça le géocentrisme par l'héliocentrisme. La méthode hypothético-déductive de Popper insiste sur la falsifiabilité. Les révolutions scientifiques, selon Kuhn, impliquent des changements de paradigmes. La science post-normale traite des questions à forts enjeux sociétaux. La reproductibilité des expériences reste un défi dans de nombreux domaines.",fr,P. Clark,Adaptation Environnementale,2025-02-10,,low_quality_corrupted
https://testsite.net/random_34?utm_campaign=promo2025,Microbiote intestinal et immunité,The sociology of social networks examines how digital platforms reshape human interactions and community formation in the digital age.,"L'intelligence artificielle générative révolutionne la création de contenu et la recherche scientifique moderne. Les modèles de langage de grande échelle comme GPT ont démontré des capacités impressionnantes dans la génération de texte cohérent, la traduction automatique et le résumé de documents complexes. Les réseaux adverses génératifs (GAN) permettent de créer des images et des vidéos réalistes à partir de descriptions textuelles. L'apprentissage par renforcement permet aux agents IA de maîtriser des jeux complexes comme les échecs, le Go et les jeux vidéo. Dans le domaine médical, l'IA assistée au diagnostic améliore la précision des radiologues et accélère la découverte de nouveaux médicaments. Cependant, les enjeux éthiques sont cruciaux : les biais algorithmiques peuvent perpétuer des discriminations, et la transparence des modèles reste un défi majeur pour la recherche en IA éthique.",,N. Lefèvre,Mammalian Behavior,2025-10-30,,off_topic
https://www.example.com/cat_light_1017?utm_source=search&utm_campaign=science,Les chats et la lumière naturelle ,"<span class='highlight'>Le</span> tapetum lucidum, structure réflective située derrière la <tt>rétine</tt> féline, augmente la sensibilité lumineuse d'un facteur six. Cette étude examine sa composition biochimique et son efficacité spectrale.","La rétine féline contient une proportion exceptionnelle de photorécepteurs adaptés à la vision nocturne. Les bâtonnets représentent 96% des photorécepteurs, contre 95% chez l'humain, mais avec une densité absolue bien supérieure. Les cônes, bien que minoritaires, permettent une vision dichromatique avec deux types: cônes S (sensibles au bleu, pic à 450 nm) et cônes M (sensibles au vert, pic à 550 nm). L'absence de cônes L explique la perception limitée des rouges. Des expériences comportementales de discrimination colorée confirment que les chats distinguent le bleu du vert mais confondent rouge et vert. Cette configuration optimise la détection de mouvements en faible luminosité au détriment de la richesse chromatique.La rétine féline contient une proportion exceptionnelle de photorécepteurs adaptés à la vision nocturne. Les bâtonnets représentent 96% des photorécepteurs, contre 95% chez l'humain, mais avec une densité absolue bien supérieure. Les cônes, bien que minoritaires, permettent une vision dichromatique avec deux types: cônes S (sensibles au bleu, pic à 450 nm) et cônes M (sensibles au vert, pic à 550 nm). L'absence de cônes L explique la perception limitée des rouges. Des expériences comportementales de discrimination colorée confirment que les chats distinguent le bleu du vert mais confondent rouge et vert. Cette configuration optimise la détection de mouvements en faible luminosité au détriment de la richesse chromatique.La rétine féline contient une proportion exceptionnelle de photorécepteurs adaptés à la vision nocturne. Les bâtonnets représentent 96% des photorécepteurs, contre 95% chez l'humain, mais avec une densité absolue bien supérieure. Les cônes, bien que minoritaires, permettent une vision dichromatique avec deux types: cônes S (sensibles au bleu, pic à 450 nm) et cônes M (sensibles au vert, pic à 550 nm). L'absence de cônes L explique la perception limitée des rouges. Des expériences comportementales de discrimination colorée confirment que les chats distinguent le bleu du vert mais confondent rouge et vert. Cette configuration optimise la détection de mouvements en faible luminosité au détriment de la richesse chromatique.",fr,N. Roux,Études Vétérinaires,2022-02-18,10.1234/cats.4302.55,exact_duplicate
